{
    "@odata.context": "/redfish/v1/$metadata#HpeBaseNetworkAdapter.HpeBaseNetworkAdapter",
    "@odata.etag": "W/\"0380262A\"",
    "@odata.id": "/redfish/v1/Systems/1/BaseNetworkAdapters/1/",
    "@odata.type": "#HpeBaseNetworkAdapter.v2_0_0.HpeBaseNetworkAdapter",
    "Id": "1",
    "FcPorts": [],
    "Firmware": {
        "Current": {
            "VersionString": "7.17.71"
        }
    },
    "Name": "HP FlexFabric 10Gb 2-port 536FLB Adapter",
    "PartNumber": "768080-001",
    "PhysicalPorts": [
        {
            "FullDuplex": true,
            "IPv4Addresses": [],
            "IPv6Addresses": [],
            "LinkStatus": null,
            "MacAddress": "f4:03:43:a8:33:80",
            "Name": "",
            "Oem": {
                "Hpe": {
                    "@odata.context": "/redfish/v1/$metadata#HpeBaseNetworkAdapterExt.HpeBaseNetworkAdapterExt",
                    "@odata.type": "#HpeBaseNetworkAdapterExt.v2_0_0.HpeBaseNetworkAdapterExt",
                    "BadReceives": 0,
                    "BadTransmits": 0,
                    "GoodReceives": 0,
                    "GoodTransmits": 0
                }
            },
            "SpeedMbps": 0
        },
        {
            "FullDuplex": true,
            "IPv4Addresses": [],
            "IPv6Addresses": [],
            "LinkStatus": null,
            "MacAddress": "f4:03:43:a8:33:88",
            "Name": "",
            "Oem": {
                "Hpe": {
                    "@odata.context": "/redfish/v1/$metadata#HpeBaseNetworkAdapterExt.HpeBaseNetworkAdapterExt",
                    "@odata.type": "#HpeBaseNetworkAdapterExt.v2_0_0.HpeBaseNetworkAdapterExt",
                    "BadReceives": 0,
                    "BadTransmits": 0,
                    "GoodReceives": 0,
                    "GoodTransmits": 0
                }
            },
            "SpeedMbps": 0
        }
    ],
    "SerialNumber": "8C9726264R",
    "Status": {
        "State": null
    },
    "StructuredName": "NIC.FlexLOM.1.1",
    "UEFIDevicePath": "PciRoot(0x2)/Pci(0x0,0x0)/Pci(0x0,0x0)"
}